{
  "schema_version": "0.1",
  "name": "30gut",
  "tcp_frame": {
    "pos_mm": [
      134.0,
      0.0,
      73.0
    ],
    "quat": [
      0.707106781187,
      0.0,
      0.707106781187,
      0.0
    ]
  },
  "weight_kg": 2.0,
  "channels": {
    "pump_a": {
      "kind": "analog",
      "description": "",
      "default_value": 0.0
    }
  },
  "mesh": "30gut.stl",
  "mesh_transform": {
    "pos_mm": [
      80.14738526982006,
      0.0006479850011658073,
      72.99416661583945
    ],
    "quat": [
      0.5000000000000001,
      0.5000000000000001,
      -0.5000000000000001,
      0.5000000000000001
    ]
  }
}